인텐트명,답변
환불문의_환불정책,"환불 가능 기준은 마지막으로 금액이 추가된 시점(충전, 결제 취소 등)의카드 잔액의 60% 이상(잔액 1만원 이하인 경우, 80% 이상)을 사용하시면 환불 가능합니다.환불신청 시 철회 불가하며 인센티브 자동 소멸 되는 점 유의 부탁드립니다. 환불 신청 후 영업일 기준 3일 이내에 입력하신 계좌로 입금됩니다. 단, 회원 개명으로 인한 예금주 불일치 혹은 환불 불가 통장(압류방지통장)의 경우, 환불이 지연될 수 있습니다.입금 기한이 지났음에도 불구하고 잔액이 환불되지 않았다면 고객센터(1899-7997)로 문의해 주세요.※ 입금자 정보는 ""코나아이""로 확인 가능합니다.※ 전체 환불만 가능하며 부분(일부잔액) 환불 불가합니다.※ 정책수당 및 인센티브(포인트)는 현금화되지 않습니다."
환불문의_환불취소,"환불 신청 취소는 불가한 점 양해 부탁드립니다.더 나은 서비스를 제공하기 위해 노력하는 경기지역화폐가 되겠습니다.추가적으로 문의사항이 있으시다면, 고객센터(1899-7997)로 문의 부탁드립니다.감사합니다.※ 고객센터 운영 시간 : 월~금(공휴일 제외) 09:00 ~ 18:00"
회원가입_가입문의,"경기지역화폐 앱(APP) 가입은 본인명의 휴대폰 인증 절차가 필요합니다.개명했을 경우 통신사를 통해 정보 변경 후 가입 진행 부탁드립니다.본인명의 휴대폰 인증으로 가입이 어렵다면 아래 방법을 참고 부탁드립니다.1. 경기지역화폐 유저사이트(PC) https://gmoney.usersite.co.kr/2. 회원가입 이력이 없을 경우 오프라인 충전처(일부 농협지점)에서 가입 가능합니다.※ 영업점으로 가입 가능 여부와 필요 서류 사전 확인 후 방문 부탁드립니다. ※ 휴대폰 SMS 인증 필요합니다. ※ 인센티브는 회원 기준으로 지급됩니다.※ 정회원(APP) 가입이 아닌 준/준준회원(PC, 영업점) 가입 시 일부 기능이 제한됩니다."
회원가입_나이제한,경기지역화폐 앱은 모바일 금융거래 서비스로 만 14세 이상 내국인이거나 외국인등록증을 보유한 외국인에 한해 회원가입할 수 있습니다.
회원가입_신용불량자,"경기지역화페는 충전형 선불카드로 신용도와 무관하게 발급 가능합니다.회원가입 진행 과정에서 소득공제 약관에 동의해 주시면 카드 등록 시, 회원님의 주민등록번호로 자동 소득공제 등록됩니다. 그외 자세한 소득공제 문의는 홈택스를 통해 문의 부탁드립니다."
회원가입_외국인,"본인인증이 가능한 외국인등록증을 소지한 외국인이라면 카드를 발급받을 수 있습니다.단, 휴대폰 명의와 계좌 명의가 반드시 일치하여야 합니다.이용이 어려울 경우 고객센터(1899-7997)로 문의해 주세요.※ 외국인 등록증이 있는 외국인의 경우 한도 상향과 소득공제 모두 가능합니다.※ 고객센터 운영 시간 : 월~금(공휴일 제외) 09:00 ~ 18:00"
회원가입_인증문자,스팸 차단 서비스가 설정된 휴대폰의 경우 인증 SMS가 스팸 문자함으로 분류될 수 있습니다. 휴대폰의 스팸 문자함을 확인해 보시기 바랍니다.
회원가입_인증실패,번거로우시겠지만 현재 설치되어 있는 앱을 삭제 후 재설치 부탁드리며 본인명의의 휴대폰인지 여부 확인 부탁드립니다. 경기지역화폐 회원가입은 본인 명의의 휴대전화에서만 가능합니다.재 설치 후에도 동일 현상이 계속적으로 반복된다면 고객센터(1899-7997)로 유선 문의해주시면 빠르게 처리 도와드리겠습니다.※ 고객센터 운영 시간 : 월~금(공휴일 제외) 09:00 ~ 18:00
회원가입_추천코드,추천코드는 회원가입시에만 기재 가능합니다.해당 코드 입력으로 별도의 혜택을 지원하지 않는 점 참고 부탁드립니다.※ 추천코드는 추후 이벤트 진행 시 활용될 수 있습니다.
회원정보_비밀번호5회오류,비밀번호 입력 5회 오류 시에는 비밀번호를 재 설정 하셔야 합니다.경기지역화폐 앱(APP) [전체메뉴 > 내정보]에서 비밀번호 변경 가능합니다.※ 휴대폰 본인 인증 절차 후 비밀번호를 재설정하실 수 있습니다.※ 고객센터에서는 개인 정보 보호를 위해 비밀번호 재설정이 불가합니다.
회원정보_아이디,ID가 이메일입니다.
회원정보_아이디비밀번호찾기,앱 로그인 화면에서 아이디/비밀번호 찾기가 가능합니다.앱 로그인 화면 하단의 '보안 비밀번호를 잊어버리셨나요?'를 눌러 본인인증 후 비밀번호를 재설정 해주시기 바랍니다.휴대폰 번호가 변경되었거나 아이디/비밀번호 찾기를 계속 실패 하신다면 고객센터(1899-7997)로 유선 문의해 주시기 바랍니다.※ 전체메뉴는 앱 우측 상단의 [≡]모양의 버튼을 누르시면 노출됩니다.※ 고객센터에서는 개인 정보 보호를 위해 유선 상의 비밀번호 재설정이 불가합니다.※ 고객센터 운영 시간 : 월~금(공휴일 제외) 09:00 ~ 18:00
회원정보_이름변경,[전체메뉴>내정보>회원정보 변경]에서 본인인증 절차를 거쳐 이름을 변경하실 수 있습니다.※ 전체메뉴는 앱 우측 상단의 [≡]모양의 버튼을 누르시면 노출됩니다.
회원정보_이메일변경,"ID 변경은 불가하며, 고객센터(1899-7997)를 통해 정보 수신 이메일 변경은 가능합니다.※ 고객센터 운영 시간 : 월~금(공휴일 제외) 09:00 ~ 18:00"
회원정보_회원정보확인,[전체메뉴>내정보]에서 회원정보 확인 가능합니다. ※ 전체메뉴는 앱 우측 상단의 [≡]모양의 버튼을 누르시면 노출됩니다.
회원정보_회원탈퇴,"경기지역화폐 회원 탈퇴를 원하시면 [전체메뉴>설정>회원탈퇴]를 눌러주세요. 탈퇴 처리 후 취소 및 철회는 불가능 하니 신중하게 결정해주세요.※ 탈퇴 조건-보유한 카드의 잔액이 '0원'이어야 한다.-보유한 카드의 정책수당(포인트)가 '0원'이어야 한다.-환불신청한 경우 처리가 완료되어야 한다.-선물의 수신 및 발신 처리가 완료되어야 한다.※ 탈퇴하는 경우 회원이 보유한 혜택(쿠폰 등)은 자동으로 소멸됩니다. 또한, 이전에 결제한 내역의 결제취소가 불가능하니 이 점 유의해주세요.※ 탈퇴 시, 등록된 지역화폐 카드는 자동 폐기됩니다."
회원정보_휴대폰변경,"1. 전화번호 변경없이 휴대폰을 바꾼 경우경기지역화폐 앱을 재설치 후 기존에 사용한 아이디와 비밀번호를 입력하면 정상적으로 로그인 됩니다. (이전에 이용하던 앱에서는 자동 로그아웃 처리 됩니다.)2. 전화번호와 휴대폰을 모두 변경한 경우경기지역화폐 앱을 재설치 후 기존에 사용한 아이디와 비밀번호를 입력하면 정상적으로 로그인 되며, 변경된 전화번호는 [전체메뉴>내정보>휴대폰번호 변경]에서 인증하면 정상적으로 사용할 수 있습니다.※ 전체메뉴는 앱 우측 상단의 [≡]모양의 버튼을 누르시면 노출됩니다.※ 통신사만 변경된 경우 별도 조치 필요 없습니다."
회원정보_휴면계정해지,휴면 해제는 아래 두가지 방법을 통해 가능합니다.① 경기지역화폐앱(APP) 로그인 완료 시② 보유한 카드로 결제 시도 → 승인 완료 시
회원정보_휴면회원,코나아이가 제공하는 온라인 서비스(APP 또는 홈페이지)에 마지막으로 접속한 날로부터 1년간 접속 기록이 없고 해당 기간 동안 카드 사용 이력이 없는 회원은 휴면 회원으로 전환됩니다.※ 휴면 회원 전환 30일 전 이메일을 통해 사전 안내됩니다.※ 최초 가입채널 로그인 시도 또는 카드 사용 시 휴면 해제 됩니다.
