인텐트명,답변
재발급_분실신고재발급,"먼저, 앱[전체메뉴 > 카드분실신고/재발급 신청]에서 분실신고 해주세요.분실 신고 즉시 카드 사용이 중지 되며, 이후 앱에서 [재발급신청]을 누르면 분실카드와 동일한 카드로 재발급 가능 합니다.* 카드 삭제로 재발급 어려운 경우 앱 메인페이지 [시/군별 카드 신청하기] 배너 이용 부탁드립니다. 재발급 신청으로 생성된 모바일 카드에 실물 카드 등록해 주시면 보유 잔액 이관되어 사용 가능합니다. 경기지역화폐 앱(APP) [내지갑>카드정보>실물카드 등록]으로 이용 부탁드립니다. 앱에서 분실신고 및 재발급이 어려우실 경우 고객센터(1899-7997)로 유선 문의해 주시면 신속하게 처리 도와드리겠습니다.※ 일반우편으로 발송되어 평일 기준 3~10일(최대 2주) 소요됩니다.※ 재발급 신청 이후 분실해제 및 발급취소 불가하니 신중한 선택 부탁드립니다. ※ 전체메뉴는 앱 우측 상단의 [≡]모양의 버튼을 누르시면 노출됩니다."
재발급_불량카드,"고장카드는 외형상 이상은 없으나 오프라인 매장에서 충전/결제가 불가한 카드입니다.우편봉투에 기재된 발신 주소로 고장카드 발송 후, 카드 상태 확인이 완료되면 새로운 정상카드로 발급 후 배송해 드립니다. (영업일 기준 5일 이내 발송)"
재발급_비용부과,재발급은 추가 재발급 비용없이 무료로 제공됩니다.
재발급_카드등록,재발급 신청으로 생성된 모바일 카드에 실물 카드 등록해 주시면 보유 잔액 이관되어 사용 가능합니다. 경기지역화폐 앱(APP) [내지갑>카드정보>실물카드 등록]으로 이용 부탁드립니다. ※ 반드시 분실신고 후 재발급 신청을 통해 발급받은 카드를 등록하셔야 합니다.
재발급_훼손카드,"훼손카드는 카드 외형상 이상이 있는 카드를 말하며, 카드의 훼손여부에 따라 새로운 정상 카드로 재발급해 드립니다.훼손카드는 실물카드 수거 후 재발급이 가능합니다. 우편봉투에 기재된 발신주소로 훼손카드를 발송 후, 카드 상태 확인이 완료되면 새로운 정상 카드 배송해 드립니다.※ 단순한 긁힘, 찍힘 등의 사유는 재발급 대상이 아닙니다."
정책수당_누락,"카드를 수령한 후에 경기지역화폐 앱에서 카드 등록이 완료되어야만 지급 가능합니다.카드를 등록했음에도 불구하고 정책수당을 받지 못하셨다면,번거로우시겠지만 고객센터(1899-7997)로 유선 문의해주시면 확인 도와드리겠습니다.※ 고객센터 운영 시간 : 월~금(공휴일 제외) 09:00 ~ 18:00"
정책수당_사용,"청년기본소득/산후조리비와 같은 정책발행금을 지급받으셨다면 요청 금액에서 자동으로 먼저 차감됩니다. 정책발행금이 결제금액보다 작은 경우, 잔액은 충전금액과 인센티브에서 결제됩니다.※ 여러 종류의 정책수당 보유 시, 정해진 기준에 따라 우선 사용됩니다.※ 정책수당 사용 순서는 변경 불가합니다."
정책수당_소득공제,"경기지역화폐 앱(APP) 회원가입 과정에서 소득공제 신청 약관에 동의해 주시면 카드 등록 시, 회원님의 주민등록 번호로 자동 소득공제 등록됩니다. 청년기본소득/산후조리비와 같은 정책발행금 사용내역도 소득공제를 받을 수 있습니다.※ 소득공제는 직불카드와 동일하게 30%로 적용되며, 추후 연말정산 진행시 국세청 사이트를 통해 확인 가능합니다.※ 경기지역화폐 앱(APP) [내지갑] 접속 후 카드명 상단 소득공제 신청 완료 문구를 확인 부탁드립니다."
정책수당_신청,"-. 청년기본소득 대상자일 경우 인터넷에서 '온라인 경기도 일자리지원시스템' 검색하여 신청해주시면 됩니다.* 청년기본소득 고객센터 : 1644-4264-. 산후조리비의 경우 출생등록 시군 관할 주민센터에서 신청하시면 됩니다.* 단, 출생일로부터 1년이내 신청하시기 바랍니다.-. 그외의 정책발행금 신청은 시군 홈페이지나 해당 정책발행금 담당자에게 문의하시기 바랍니다.-. 지원금 지급되었을 경우,[경기지역화폐 앱(APP) > 내지갑 > 이용내역 > 정책발행금]을 통해 확인 가능합니다."
정책수당_유효기간,"시·군별 또는 수당 종류별로 유효기간이 상이할 수 있습니다. [ 내지갑 > 이용내역>정책발행금내역]의 [안내]에서 지급받은 수당의 유효기간을 확인할 수 있습니다.매월 초 메일/PUSH를 통해 익월 소멸되는 포인트에 대한 안내를 안내하오니, 꼭 확인하여 주시기 바랍니다. ※ PUSH 재확인 방법 : 전체메뉴>종모양>내소식"
정책수당_정책수당이란,경기지역화폐는 잔액 충전으로 제공되는 인센티브 외에도 청년기본소득과 산후조리비와 같은 지원금을 카드형 지역화폐로 발행하여 지원하고 있습니다.※ 정책발행금 대상자 확인 및 관련 사항은 시군 홈페이지와 해당 정책발행금 담당자에게 문의하시기 바랍니다.
정책수당_지급내역,경기지역화폐 앱의 [내지갑]에서 해당 카드의 [사용가능금액]옆의 화살표 버튼을 누르면 확인할 수 있습니다. 정책발행금이 카드에 지급되면 별도의 push 메시지를 통해 안내해 드립니다.※ 주카드 설정 시 경기지역화폐 앱(APP) 메인화면에서 잔액 확인 가능합니다.주 카드 설정 방법 [내지갑]에서 설정할 카드 디자인의 좌측상단 별(☆)모양을 눌러주세요.
정책수당_카드등록,카드를 수령하셨다면 앱에 사용등록하시기 바랍니다. 경기지역화폐 앱 접속 후 첫화면의 [카드 등록하기] 또는 [내지갑>왼쪽 상단 카드등록]를 통해 카드 바코드 스캔 또는 카드번호/유효기간/CVC 정보를 직접 입력하는 방식으로 간편하게 사용등록 하실 수 있습니다. 카드 사용등록이 완료되면 정책발행금 지급일에 자동으로 수당이 지급됩니다. 카드 사용등록이 어려우실 경우 고객센터(1899-7997)로 유선문의 주시면 친절하게 안내해드리겠습니다. ※ 정책발행금 종류에 따라 신청방법이 상이합니다. 정책발행금 신청에 대해 궁금하신 부분은 각 시·군 홈페이지나 해당 정책발행금 담당자에게 문의하시기 바랍니다.
정책수당_카드수령,"신청 완료 후 대상자 확정이 완료된 분에 한하여 거주하고 계신 주소지로 카드를 발송해드립니다.카드는 발송일로부터 영업일 기준 10일 이내에 일반 우편으로 배송됩니다. 해당 기간 내 우편함을 확인해주세요. 단, 일반 우편이므로 주소가 명확하지 않은 경우 반송되거나, 공동 우편함일 경우 분실될 우려가 있습니다.도착까지 다소 시간이 걸릴 수 있으니, 신청 후 2주가 지나도록 우편함에서 확인이 어려우신 경우 고객센터(1899-7997)로 유선 문의해 주시면 신속하게 확인해드리겠습니다. ※ 정책발행금 지급을 위한 카드는 대상자 확정기간에 따라 추가 시일이 소요될 수 있습니다.  ※ 배송지 재확인 방법 : 전체메뉴>종모양>내소식※ 정책수당 수령을 위해 오프라인(지자체)에서 카드 신청한 경우, 고객센터를 통해 배송 주소지 확인 가능합니다. ※ 고객센터 : 1899-7997 (주말, 공휴일 제외 09:00 ~ 18:00)"
충전계좌_계좌등록,"경기지역화폐는 휴대폰명의와 동일한 입/출금계좌만 등록이 가능 합니다. 경기지역화폐 앱(APP) [전체메뉴 > 연결된 계좌]에서 등록 및 변경 가능합니다.※ 사업계좌/평생계좌/타인명의(또는 예금주불일치)계좌는 등록 불가합니다.※ 연결시도 계좌의 비대면거래정지, 인증제한이 되어있는 경우에도 등록이 어렵습니다.※ 예금주에 성명(000)이 기재된 경우에도 예금주명 불일치로 인증이 되지 않습니다.※ 단위 농협 계좌 연결 시, 지역 농축협이 아닌 NH농협 선택할 경우 인증되지 않습니다.지속적으로 계좌등록이 안 된다면 번거로우시겠지만 앱 삭제후 재설치 부탁드립니다. 앱 삭제후 재설치 하셨음에도 [유효하지 않은 계좌]라고 확인된다면 죄송하지만, 고객센터(1899-7997)로 유선문의 해주시기 바랍니다.※ 고객센터 운영 시간 : 월~금(공휴일 제외) 09:00 ~ 18:00"
충전계좌_계좌변경,"앱에 연결된 계좌는 [전체 메뉴>연결된 계좌 변경]에서 변경이 가능합니다.※ 등록된 계좌는 삭제가 불가합니다.※ 전체메뉴는 앱 우측 상단의 [≡]모양의 버튼을 누르시면 노출됩니다.※ 본인명의의 계좌만 등록/변경 가능합니다.※ 사업자계좌, 보안계좌, 평생계좌의 경우 등록이 불가합니다."
충전계좌_계좌삭제,"연결 계좌는 고객센터 통해 본인 확인 후 삭제 가능합니다. ※고객센터 : 1899-7997 (주말, 공휴일 제외 09:00 - 18:00)※ 삭제 완료된 경우 APP에 반영됩니다."
충전계좌_계좌연결오류,"경기지역화폐는 휴대폰명의와 동일한 입/출금계좌만 등록이 가능 합니다. 사업계좌/평생계좌/타인명의(또는 예금주불일치)계좌는 등록 불가하오니 참고 바랍니다.※ 경기지역화폐 APP 전체메뉴 > 연결된 계좌를 통해 등록 및 변경 가능합니다.※연결시도 계좌의 비대면거래정지, 인증제한이 되어있는 경우에도 등록이 어렵습니다.※예금주에 성명(000)이 기재된 경우에도 예금주명 불일치로 인증이 되지 않습니다.※ 단위 농협 계좌 연결 시, 지역 농축협이 아닌 NH농협 선택할 경우 인증되지 않습니다.지속적으로 계좌등록이 안 된다면 번거로우시겠지만 앱 삭제후 재설치 부탁드립니다. 앱 삭제후 재설치 하셨음에도 [유효하지 않은 계좌]라고 확인된다면 죄송하지만, 고객센터(1899-7997)로 유선문의 해주시기 바랍니다.※ 고객센터 운영 시간 : 월~금(공휴일 제외) 09:00 ~ 18:00"
충전계좌_카카오미니계좌불가,카카오뱅크 미니계좌는 경기지역화폐 계좌 연결 불가한 계좌입니다.다른 일반계좌로 연결 부탁드립니다.
충전계좌_타인계좌등록,타인 명의의 은행 계좌는 등록이 불가합니다.안전한 서비스 제공을 위하여 본인 명의의 은행 계좌를 등록해 주세요.
충전문의_자동충전,경기지역화폐는 고객님들의 편리한 카드 사용을 위해 자동 충전 기능을 제공하고 있습니다.자동 충전은 '기준 하한/월정액 충전'과 '결제시 부족금액 충전' 중에 선택할 수 있습니다.- 기준 하한 충전: 카드 잔액이 설정한 기준보다 낮아지면 지정된 금액이 자동으로 충전되는 기능- 월 정액 충전: 매월 지정된 날짜에 설정한 금액이 자동으로 충전되는 기능- 결제시 부족금액 충전 : 5만원 기준으로 5만원 또는 부족한 금액만큼 충전되는 기능
충전문의_자동충전해지,[내지갑>충전>자동충전 설정하기]에서 '자동충전 해지하기'를 선택해 주세요.
충전문의_충전방법,"경기지역화폐는 [충전형 선불카드]로 충전이 필요합니다. 카드 잔액을 충전을 하기 위해서 먼저, 본인 명의 은행계좌를 앱에 연결해주시기 바랍니다. 계좌 등록이 완료되면 [내지갑>충전]을 통해 충전이 가능합니다.※ 씨티은행/평생 은행 계좌/타인명의(또는 예금주 불일치)/가상계좌/사업주 계좌는 지원하지 않습니다.※ 해당 은행사 서비스 점검시간 확인 후 이용 부탁드립니다."
충전문의_충전수단,"경기지역화폐는 [충전형 선불카드]로 잔액 충전이 필요합니다. 계좌이체 충전 및 오프라인 충전을 제공하고 있습니다.1. 계좌이체 충전경기지역화폐는 휴대폰명의와 동일한 입/출금계좌만 등록이 가능 합니다.사업계좌/평생계좌/타인명의(또는 예금주불일치)계좌는 등록 불가하오니 참고 바랍니다.2. 오프라인 충전APP 사용이 어렵거나 계좌 연결이 불가한 경우 이용하시는 지역의 농협, 신협, 새마을 금고 은행에서 충전 가능합니다.지점별로 충전가능여부가 상이하니 번거로우시더라도 방문 전 연락하시어 확인 부탁드립니다※ 오프라인 충전의 경우 현금과 신분증이 필요할 수 있습니다. ※ 인센티브는 회원(1인) 기준으로 지급 한도가 책정되어 있습니다."
충전문의_충전수수료,충전 시 수수료가 부과되지 않습니다.
충전문의_충전오류,"충전 오류의 대표적인 사례 및 해결방법 안내드리겠습니다.① 1일 출금한도가 지정되어 있는 경우, 은행사 고객센터를 통해 확인이 필요합니다.② 해당 은행사 시스템 점검 중일 경우, 추후 재시도 부탁드립니다.③ 지역화폐 충전을 장기간 하지 않았을 경우, 계좌 [변경] 재등록이 필요합니다.④ 오픈뱅킹 미동의 경우, 전체 동의 후 재시도 부탁드립니다.⑤ 비대면 출금 미동의 경우, 은행사 고객센터를 통해 확인이 필요합니다.위 5가지 사례에 해당되지 않고, 지속적으로 계좌 충전이 안된다면경기지역화폐 앱(APP) 삭제 후 재설치 부탁드립니다.시도 후에도 충전 불가할 시,죄송하지만 고객센터(1899-7997)를 통해 재문의 부탁드립니다.※ 고객센터 운영 시간 : 월~금(공휴일 제외) 09:00 ~ 18:00"
충전문의_충전취소,"충전 취소는 APP충전을 하신 후 사용 이력(결제 내역)이 없을 경우,7일 이내(충전일 포함)에 APP 내 충전 취소가 가능합니다.[내지갑>이용내역]에서 충전한 내역을 선택한 후 하단의 [충전취소]를 눌러주세요.※ 잔액의 부분 취소는 불가합니다.※ 충전 취소한 금액은 3일 이내 등록된 계좌로 환불됩니다.※ 충전 취소 시에는 충전 시 지급된 인센티브는 전액 환수됩니다.※ 충전 이후, 결제 내역이 없으나 잔액이 변경(+)된 경우 (결제 취소, 재발급 카드로 이관, 돈 옮기기 등) 충전 취소가 불가합니다.※ 잔액이 변경된 경우(결제 취소/ 재발급 카드로 이관. 돈 옮기기 등) 카드 잔액이 (+) 시점을 기준으로, 해당 잔액의 60% 이상을 결제로 사용해야 남은 금액을 환불할 수 있습니다."
충전문의_충전한도,"카드 당 최대 50만원까지 충전이 가능하며, 앱의 [전체메뉴>충전한도 상향]에서 카드 선택 후 한도를 상향하면 최대 200만원까지 사용할 수 있습니다.충전 한도 상향을 위해 기명카드로 전환 시, 본인인증을 필수로 진행하셔야 합니다. ※ 외국인 등록증이 있는 외국인의 경우 한도 상향과 소득공제 모두 가능합니다."
카드문의_결제일,경기지역화폐는 충전형 선불카드로 별도 결제일이 없습니다.
카드문의_모바일카드,경기지역화폐 APP에서 카드 신청 시 모바일 카드가 생성됩니다.실물카드 수령 전 잔액 충전 및 삼성페이(삼성폰) 등록 후 이용 가능합니다.※ 경기지역화폐>내지갑에서 발급받은 카드 확인 가능합니다.※ 생성된 모바일 카드와 배송되는 실물카드 번호는 상이합니다.※ 내지갑>카드정보>실물카드 등록 시 두 카드는 연동됩니다.
카드문의_모바일카드발급,"경기지역화폐 앱(APP)을 통해 카드 신청 시, 모바일 카드가 생성됩니다. 경기지역화폐 앱(APP) [내지갑] 메뉴를 통해 발급된 모바일카드 확인 가능합니다. 모바일 카드는 일부 정책지원금 신청 및 지급, 충전 가능하며모바일 카드로 지급받은 지원금 및 충전 금액은 배송받은 카드 등록 후 실물카드 IC칩 결제 및 삼성페이 간편결제 방법으로 사용가능합니다.※ 실물카드 등록 방법 : 경기지역화폐 앱(APP) [내지갑 > 카드정보 > 실물카드 등록]"
카드문의_무기명카드,일부 정책수당 지원금 신청으로 발급받은 무기명(앱에 등록되지 않은 카드)카드는 ARS 잔액조회 또는 앱에 등록 후 이용 내역 확인 가능합니다. - ARS[1899-7997 > 2번 > 1번 > 카드번호 16자리 입력]- 미등록 카드 잔액조회 홈페이지[https://www.konacard.co.kr/check]- 이용내역은 APP에 등록 후 확인 가능합니다.
카드문의_발급비용문의,카드 발급은 비용없이 무료로 제공됩니다.
카드문의_신청카드안보임,경기 지역화폐 카드 재고 상황에 따라 일부 상품은 신청이 불가 할 수 있습니다. 이점 양해 부탁 드립니다.
카드문의_양도,경기지역화폐는 무기명(공카드)로 배송되어 필요하신 분께 양도 가능합니다. ※ APP에 등록한 회원이 카드 명의자가 됩니다.※ 인센티브는 계정(1인)당 지급 한도가 책정되어 있습니다.※ 정책발행금의 경우 신청 정보와 카드 명의자가 일치되어야 지급됩니다.
카드문의_오프라인카드발급,"경기지역화폐 회원가입 이력 없으실 경우 오프라인 은행 방문으로 카드 발급 가능합니다.이용하시려는 지역의 농협, 신협, 새마을 금고 은행사 방문하시어 발급 신청 가능하지만 은행사 별 경기지역화폐 카드 발급 여부 상이한 점 양해부탁드립니다.방문 전 해당 은행 고객센터를 통해 경기지역화폐 카드 발급 가능 여부 확인 후 방문 부탁드립니다."
카드문의_웰컴카드란,경기지역화폐 앱에 신규 가입시 최초 발급되는 IC 카드입니다.신청한 카드는 영업일 기준 10일 이내에 일반우편으로 배송됩니다.회원 가입 시 웰컴카드를 신청하지 못한 고객님은 경기지역화폐 고객센터(1899-7997)로 문의 주시길 바랍니다.
카드문의_유효기간,"실물카드로 발급된 경기지역화폐 카드는 유효기간 연장을 지원하지 않으며, 만료 시 사용이 불가하므로 직접 재발급 해주셔야 합니다.카드 유효기간은 후면 또는 앱을 통해 확인이 가능합니다.[내지갑>카드 정보]에서 등록된 카드의 유효기간을 확인해 주세요."
카드문의_지역이동,"지역화폐는 지자체 별로 운영하고 있습니다.지역화폐는 앱에서 지자체를 선택하여  지역별 카드 신청 가능합니다 예) 화성시 1장, 오산시 1장신청 후 해당하는 지역내에서 사용 가능합니다.앱> 시,군별 카드 신청하기 에서 신청 가능합니다. 카드 수령 후 앱에서 사용등록, 충전해서 이용 가능합니다.각 지역화페 별로 충전해서 해당 지자체 관내에서 이용 가능하고 카드 간 금액 공유는 불가합니다.※ 타지역 전출로 잔액 환불이 필요한 경우 고객센터로 문의 부탁드립니다.고객센터 : 1899-7997 (주말, 공휴일 제외 09:00 - 18:00)"
카드문의_추가발급,"경기지역화폐는 일부 지자체(김포, 성남, 시흥)를 제외한 28개 지자체의 지역화폐를 운영하고 있습니다.소지한 카드 외 다른 지역의 카드를 추가로 발급하실 수 있습니다. 경기지역화폐 앱 메인페이지의 화면의 [시/군별 카드 신청하기] 배너를 찾으실수 있습니다.※ 신청한 카드는 영업일 기준 10일 내에 일반우편으로 배송됩니다. ※ 동일한 시의 지역화폐 카드를 여러 장 사용 가능하지만, 인센티브 혜택은 중복적용이 불가합니다."
카드문의_카드교체,"경기지역화폐는 다음 경로를 통해 추가 발급 또는 재발급 신청 가능합니다. 1. 경기지역화폐 앱(APP) 메인화면 하단 [시/군별 카드 신청하기] 2. 경기지역화폐 앱(APP) [전체메뉴(≡) > 분실신고/재발급 신청]※ 재발급은 신청 이후 분실해제 및 발급취소 불가하니 신중한 선택 부탁드립니다. ※ 신청한 카드는 영업일 기준 10일 내에 일반우편으로 배송됩니다. ※ 동일한 시의 지역화폐 카드를 여러 장 사용 가능하지만, 인센티브 혜택은 중복적용이 불가합니다."
카드문의_카드목록,경기지역화폐 앱 [내지갑]에서 보유 중인 카드 목록 확인 가능합니다. Tip> 주 카드 설정 방법 [내지갑]에서 설정할 카드 디자인의 좌측상단 별(☆)모양을 눌러주세요.
카드문의_카드발급,"경기지역화폐 카드는경기도를 사랑하는 사람이라면 주소지와 상관없이 누구나 발급이 가능합니다. 경기지역화폐 앱(APP) 메인화면 [시/군 별 카드신청하기] 배너에서 신청 가능합니다.※경기지역화폐 앱에 회원가입은 만14세 이상에 한해 가능합니다.※ 정책발행 카드의 경우 대상자에 한해 발급받을 수 있습니다.※ 신청한 카드는 영업일 기준 10일 내에 일반우편으로 배송됩니다. ※ 동일한 시의 지역화폐 카드를 여러 장 사용 가능하지만, 인센티브 혜택은 중복적용이 불가합니다."
카드문의_카드발급취소,"경기지역화폐 발급 취소는 카드 신청 당일에 한해 가능합니다.앱(APP) [전체메뉴 > 카드 발급현황]에서 취소 가능합니다.다만, 재발급 신청 카드는 취소 불가합니다. ※ APP에 등록한 회원이 카드 명의자가 됩니다.※ 인센티브는 계정(1인)당 지급 한도가 책정되어 있습니다.※ 정책발행금의 경우 신청 정보와 카드 명의자가 일치되어야 지급됩니다."
카드문의_카드번호,"경기지역화폐카드는 무기명카드 배송으로 실물 카드번호 확인은 어렵습니다.경기지역화폐 앱(APP)을 통해 카드 신청 시,[경기지역화폐 앱(APP) > 내 지갑]을 통해 모바일 카드번호 확인이 가능합니다."
카드문의_카드삭제,[경기지역화폐 APP>내지갑>카드관리]에서 카드 삭제(해지) 가능합니다.앱에서 카드 삭제 시 해당 카드는 폐기되어 재사용은 불가합니다.신규 카드 발급을 원하실 경우 앱 메인 페이지의 [시/군별 카드 신청하기]배너를 통해 추가 발급하여 이용해주시기 바랍니다.
카드문의_카드재등록,등록 후 삭제된 카드는 폐기 처리되어 재등록 및 복구가 불가합니다.경기지역화폐 앱 메인페이지 [시/군별 카드 신청하기] 배너에서 재발행 신청 후 이용 부탁드립니다.
카드문의_카드정지,경기지역화폐 앱(APP) 전체메뉴 [분실신고/재발급 신청] 메뉴에서 카드 정지 가능합니다. 필요하신 경우 동일한 경로를 통해 분실 해제 후 사용 가능합니다.※ 분실신고 후 재발급까지 진행된 경우 분실 해제 불가합니다. ※ 전체메뉴는 앱 우측 상단의 [≡]모양의 버튼을 누르시면 노출됩니다.
환불문의_만료카드환불,유효기간이 만료된 카드의 환불은 [전체메뉴>카드환불신청/조회]에서 신청할 수 있으며 보유 잔액의 90%까지 환불 가능합니다. 영업일 기준 3일 이내 앱에 연결된 계좌로 잔액이 입금됩니다.
환불문의_사망자,"사망자 상속의 경우 대표 상속인 기준으로 잔액 환불을 도움드리고 있습니다.필요 서류 및 절차에 대해 번거로우시더라도 고객센터 1899-7997로 문의 부탁드립니다.※ 카드캐시(정책발행금)의 경우 현금으로 전환되지 않습니다. ※ 고객센터 운영시간 : 주말, 공휴일 제외 9:00 - 18:00"
환불문의_신청방법,"환불 가능 기준은 마지막으로 금액이 추가된 시점(충전, 결제 취소 등)의카드 잔액의 60% 이상(잔액 1만원 이하인 경우, 80% 이상)을 사용하시면 환불 가능합니다.환불신청 시 철회 불가하며 인센티브 자동 소멸 되는 점 유의 부탁드립니다. * 환불 방법[경기지역화폐 앱(APP) > 오른쪽 상단 메뉴(三) > 카드 환불신청/조회]카드 배송 시, 동봉된 안내문과 약관 참조해 주시기 바랍니다.환불 신청된 금액은 3~7일 후 연결된 계좌로 입금됩니다.추가적으로 문의사항이 있으시다면, 고객센터(1899-7997)로 문의 부탁드립니다.※ 고객센터 운영 시간 : 월~금(공휴일 제외) 09:00 ~ 18:00"
환불문의_이사,"이사로 인해 보유하고 있는 지역화폐 카드 사용이 어려울 경우,경기지역화폐 고객센터(1899-7997)를 통해전입/출 이력을 확인할 수 있는 등본 확인 후 환불 가능 여부를 안내해드리도록 하겠습니다.※ 환불 신청 완료 시, 평일 기준 3~7일 소요 되는 점 양해 부탁드립니다.※ 전입 신고 후 카드 사용 이력 있을 경우, 환불 불가한 점 양해부탁드립니다.번거로우시겠지만 고객센터(1899-7997)를 통해 이사 환불 신청 부탁드립니다.※ 고객센터 운영 시간 : 월~금(공휴일 제외) 09:00 ~ 18:00"
